{
  "id": "example-database-credential",
  "code": "SQL",
  "uuid": "c56137f5-592f-42ea-bf6e-b23d4eae89fb",
  "name": {
    "en": "Database Credentials",
    "cs": "Přihlašovací údaje k databázi",
    "de": "Datenbank-Zugangsdaten"
  },
  "description": {
    "en": "Credentials required to access a database.",
    "cs": "Přihlašovací údaje potřebné pro přístup k databázi.",
    "de": "Zugangsdaten für den Zugriff auf eine Datenbank."
  },
  "fields": [
    {
      "keyword": "DATABASE_USER",
      "name": {
        "en": "Username",
        "cs": "Uživatelské jméno",
        "de": "Benutzername"
      },
      "type": "string",
      "description": {
        "en": "The username for database authentication.",
        "cs": "Uživatelské jméno pro autentizaci k databázi.",
        "de": "Der Benutzername für die Datenbank-Authentifizierung."
      },
      "required": true
    },
    {
      "keyword": "DATABASE_PASSWORD",
      "name": {
        "en": "Password",
        "cs": "Heslo",
        "de": "Passwort"
      },
      "type": "password",
      "description": {
        "en": "The password for database authentication.",
        "cs": "Heslo pro autentizaci k databázi.",
        "de": "Das Passwort für die Datenbank-Authentifizierung."
      },
      "required": true
    },
    {
      "keyword": "DATABASE_TYPE",
      "name": {
        "en": "Database Type",
        "cs": "Typ databáze",
        "de": "Datenbanktyp"
      },
      "type": "select",
      "description": {
        "en": "Type of the database to connect to.",
        "cs": "Typ databáze, ke které se připojujete.",
        "de": "Typ der Datenbank, zu der eine Verbindung hergestellt werden soll."
      },
      "options": ["MySQL", "PostgreSQL", "SQLite", "Oracle"],
      "required": true,
      "default": "MySQL"
    },
    {
      "keyword": "DATABASE_HOST",
      "name": {
        "en": "Host",
        "cs": "Hostitel",
        "de": "Host"
      },
      "type": "string",
      "description": {
        "en": "Hostname or IP address of the database server.",
        "cs": "Hostitel nebo IP adresa databázového serveru.",
        "de": "Hostname oder IP-Adresse des Datenbankservers."
      },
      "required": true,
      "default": "localhost"
    },
    {
      "keyword": "DATABASE_PORT",
      "name": {
        "en": "Port",
        "cs": "Port",
        "de": "Port"
      },
      "type": "number",
      "description": {
        "en": "Port number for the database connection.",
        "cs": "Číslo portu pro připojení k databázi.",
        "de": "Portnummer für die Datenbankverbindung."
      },
      "required": false,
      "default": 3306
    }
  ]
}